,index,ISBN,Book-Title,Book-Author,Year-Of-Publication,Publisher,Image-URL-S,Image-URL-M,Image-URL-L,category,description,title,also_buy,rank,also_view,price,asin,match_value
15,15,1567407781,The Witchfinder (Amos Walker Mystery Series),Loren D. Estleman,1998,Brilliance Audio - Trade,http://images.amazon.com/images/P/1567407781.01.THUMBZZZ.jpg,http://images.amazon.com/images/P/1567407781.01.MZZZZZZZ.jpg,http://images.amazon.com/images/P/1567407781.01.LZZZZZZZ.jpg,"['Books', 'Comics &amp; Graphic Novels', 'Graphic Novels']","['Mike Mignola was born September 16, 1960 in Berkeley, California and grew up in nearby Oakland. His fascination with ghosts and monsters began at an early age and reading Dracula at age 13 introduced him to Victorian literature and folklore from which he has never recovered. In 1993 Mike created <i>Hellboy</i>-- a half-demon occult detective who may or may not be the Beast of the Apocalypse. While the first story line, <i>Seed of Destruction</i>, was co-written by John Byrne, Mike has continued writing the series himself. There are numerous <i>Hellboy</i> graphic novel collections with more on the way, several spin-off titles (<i>BPRD</i>, <i>Lobster Johnson</i>, <i>Abe Sapien</i> and <i>Witchfinder</i>), three anthologies of prose stories, several novels, two animated films, and two live action films staring Ron Perlman. <i>Hellboy</i> has earned numerous comic industry awards and is published in a great many countries. The author lives in Los Angeles, California.', '', '']",Witchfinder Volume 3 The Mysteries of Unland,"['1506701663', '1595827943', '1595824839', '1506701558', '161655505X', '150670672X', '1506704980', '1506702066', '1506705316', '1506701787', '1506701434', '1616553952', '1506702074', '1616557826', '1506703453', '1616559675', '1616556226', '1616552034', '1595826769', '1506706835', '1506701965', '1616556463', '1616556412', '1616556609', '1595826750', '1506703607', '1616550317', '1506703887', '1506705383', '1506704883', '1616558970', '1506703852', '1595827560', '1616555106', '1506704905', '1616552387', '1506704662', '1506706541', '1593079753', '150670011X', '1506701310', '1506706533', '1506702201', '1616559101', '1506706657', '161655794X', '1506706649', '1506711987', '1506706673', '1506706665', '1616553286', '1595829253', '1616557621', '161655617X', '1506706681', '1616556560', '1506703631', '1616556188', '1616558210', '1616558911', '1506701132', '1401258069', '1616555157', '1506700314', '1616554029', '1506701973', '1506707491', '1506708145', '1595826734', '1506708153', '1616551828', '1595821856', '1616554436', '161655133X', '1616554444', '1506710492', '150670042X', '1595828869', '1616554711', '1506703437', '1506710506', '1595827072', '1506711995', '1616551968', '1595826580', '1593079109', '1616551992', '1616559640', '1616551402', '1506706827', '1250077680', '1595826742', '1595825010', '1616557869', '1593079893', '1595829814', 'B00IF8Q5MQ', '1401211534', '1506705448']","131,351 in Books (","['1506706649', '1595824839', '1506701663', '1595827943', '1593079753', '1506706835', '161655505X', '1616553952', '1616557826', '1616555106', '1616556463', '1616552034', '1506705316', '150670672X', '1506701787', '1616551968', '1506701558', '1616556412', '1506704980', '1595826750', '1506706533', '1506703453', '1506704905', '1506702066', '1616556609', '1506703607', '1595827560', '1616550317', '1616552387', '1506704883', '1506701965', '1616556226', '1616559675', '1616558970', '1506705383', '1506702074', '1506708153', 'B0068F26Z8', '1506703631', '1506704662', '1506707491', '1595826769', '1506703437', '1506706541', '1506701434', '1506701132', '1506701973', '2756069957', '1785658832', '1616559640', '1595828869', '1506706681', '1506706665', '150670395X', '1506706673', '1781165742', '1595823522', '1506703852', '1506703887', '0785156593']",$16.00,1616556307,70
16,16,1575663937,More Cunning Than Man: A Social History of Rats and Man,Robert Hendrickson,1999,Kensington Publishing Corp.,http://images.amazon.com/images/P/1575663937.01.THUMBZZZ.jpg,http://images.amazon.com/images/P/1575663937.01.MZZZZZZZ.jpg,http://images.amazon.com/images/P/1575663937.01.LZZZZZZZ.jpg,"['Books', 'Science & Math', 'Biological Sciences']",[],More Cunning Than Man: A Social History of Rats and Man,"['1582344779', '1107156947']","1,067,857 in Books (",[],,1575663937,100
17,17,1881320189,Goodbye to the Buttermilk Sky,Julia Oliver,1994,River City Pub,http://images.amazon.com/images/P/1881320189.01.THUMBZZZ.jpg,http://images.amazon.com/images/P/1881320189.01.MZZZZZZZ.jpg,http://images.amazon.com/images/P/1881320189.01.LZZZZZZZ.jpg,"['Books', 'Literature &amp; Fiction', 'Genre Fiction']","['', '', '', '', '<b>Julia Oliver</b> is an independent writer living in Montgomery. In <br /> addition to this novel, she has written a much-anticipated second novel, <br /><i>Music of Falling Water</i>, and a highly acclaimed collection of short <br /> stories, <i>Seventeen Times as High as the Moon</i>.', '', '', '', '']",Goodbye to the Buttermilk Sky (Deep South Books),[],"4,498,161 in Books (",[],$9.73,0817311459,77
18,18,0440234743,The Testament,John Grisham,1999,Dell,http://images.amazon.com/images/P/0440234743.01.THUMBZZZ.jpg,http://images.amazon.com/images/P/0440234743.01.MZZZZZZZ.jpg,http://images.amazon.com/images/P/0440234743.01.LZZZZZZZ.jpg,"['Books', 'Literature & Fiction', 'Literary']","['Alis Hawkins is an independent speech and language therapist, working in schools. She studied English at Cambridge University and lives in Canterbury.']",Testament,[],"19,310,758 in Books (",[],$6.16,0230700012,82
19,19,0452264464,Beloved (Plume Contemporary Fiction),Toni Morrison,1994,Plume,http://images.amazon.com/images/P/0452264464.01.THUMBZZZ.jpg,http://images.amazon.com/images/P/0452264464.01.MZZZZZZZ.jpg,http://images.amazon.com/images/P/0452264464.01.LZZZZZZZ.jpg,"['Books', 'Christian Books & Bibles', 'Christian Living']",[],Beloved Come Closer,[],"5,348,097 in Books (",[],$7.18,1604773049,64
